{
  "project": {
    "project_id": "karna-full-journey",
    "project_name": "कर्ण — सूर्यपुत्र की पूरी गाथा",
    "format": "LONGFORM",
    "language": "hi-IN",
    "target_duration_seconds": 210
  },
  "story": {
    "title": "कर्ण — सूर्यपुत्र की पूरी गाथा",
    "hook": "यह कहानी एक ऐसे योद्धा की है, जो जन्म से राजकुमार था, पर जाना गया एक सारथी के पुत्र के नाम से।",
    "premise": "कुंती को मिले एक दिव्य वरदान से जन्मा कर्ण, समाज के भय के कारण नदी में बहा दिया गया, एक सारथी परिवार में पला-बढ़ा, और जीवन भर अपनी असली पहचान और अपनी वफ़ादारी के बीच के द्वंद्व से जूझता रहा।",
    "conflict": "जन्मसिद्ध राजसी अधिकार बनाम अर्जित वफ़ादारी — कर्ण को उसकी असली पहचान और दुर्योधन के प्रति उसके ऋण के बीच चुनना पड़ता है, ठीक उस समय जब उसकी सबसे बड़ी सुरक्षा भी खतरे में पड़ जाती है।",
    "reveal": "युद्ध से ठीक पहले, स्वयं इंद्र एक याचक के वेश में कर्ण की जन्मजात दिव्य सुरक्षा — कवच और कुंडल — माँगने आते हैं, और कर्ण उन्हें पहचान लेता है।",
    "climax": "कर्ण बिना झिझक अपना कवच और कुंडल स्वयं उतारकर याचक को सौंप देता है, यह जानते हुए भी कि इससे वह युद्ध में असुरक्षित हो जाएगा।",
    "payoff": "इंद्र प्रभावित होकर बदले में शक्ति अस्त्र देते हैं, पर कर्ण की असली पहचान उस अस्त्र से नहीं — उसके त्याग और उसके धर्म से बनती है।",
    "emotional_core": "सच्चा दान और सच्ची वफ़ादारी वही है जो सबसे बड़ी कीमत पर भी बिना शर्त निभाई जाए।",
    "story_arc": "हुक (पहचान का रहस्य) → स्थापना (जन्म और त्याग) → उभार (संघर्ष और स्वीकृति) → मोड़ (चुनाव का क्षण) → रहस्योद्घाटन (याचक की पहचान) → चरम (बिना शर्त त्याग) → परिणाम (धर्म की सच्ची परिभाषा)।",
    "facts": [
      "महाभारत के अनुसार कुंती को सूर्यदेव सहित किसी भी देवता का आवाहन करने में सक्षम एक मंत्र का वरदान प्राप्त था।",
      "कर्ण का जन्म सूर्यदेव से हुआ, और वे जन्म से ही दिव्य कवच और कुंडल के साथ पैदा हुए थे, जो उनके शरीर से जुड़े थे।",
      "अविवाहित कुंती ने अपने नवजात पुत्र को एक टोकरी में नदी में प्रवाहित कर दिया।",
      "सारथी अधिरथ और उनकी पत्नी राधा ने कर्ण को अपने पुत्र के रूप में पाला।",
      "गुरु द्रोणाचार्य ने कर्ण को उसकी जाति के कारण शिक्षा देने से इनकार किया था।",
      "दुर्योधन ने कर्ण को अंग देश का राजा घोषित किया, जिससे दोनों में गहरी मित्रता बनी।",
      "युद्ध से पहले कृष्ण और कुंती ने कर्ण को उसकी असली पहचान बताई और पांडवों की ओर से राज्य का प्रस्ताव दिया, जिसे कर्ण ने अस्वीकार कर दिया।",
      "इंद्र ब्राह्मण का वेश धरकर कर्ण से उसका कवच और कुंडल माँगने आए, और कर्ण ने उन्हें पहचानकर भी दान दे दिया।",
      "इंद्र ने बदले में कर्ण को एक बार प्रयोग होने वाला शक्ति अस्त्र प्रदान किया।"
    ],
    "interpretations": [
      "कर्ण के आंतरिक द्वंद्व, उसके ठीक-ठीक विचार और संवाद कथा-परंपरा व नाट्य रूपांतरणों में विस्तृत हुए हैं, मूल श्लोकों में शब्दशः नहीं मिलते।",
      "द्रोणाचार्य और कृपाचार्य के प्रश्नों का सटीक शब्दांकन अलग-अलग परंपराओं और पुनर्कथन में भिन्न है।"
    ]
  },
  "script": {
    "full_narration": "यह कहानी एक ऐसे योद्धा की है, जो जन्म से राजकुमार था, पर जाना गया एक सारथी के पुत्र के नाम से। और जिस दिन उसकी असली पहचान सामने आई, वह पहले ही अपनी सबसे बड़ी सुरक्षा किसी और को दे चुका था। यह कथा शुरू होती है राजकुमारी कुंती से, जिन्हें एक दिव्य मंत्र का वरदान मिला था — जिससे वे किसी भी देवता का आवाहन कर सकती थीं। बाल्यावस्था की जिज्ञासा में, कुंती ने सूर्यदेव का आवाहन किया। उसी क्षण, सूर्यदेव के आशीर्वाद से एक पुत्र का जन्म हुआ — कवच और कुंडल सहित, उसके शरीर से जुड़े हुए। समाज के भय से, अविवाहित कुंती को अपने नवजात पुत्र को एक टोकरी में नदी में बहा देना पड़ा। वह पुत्र था — कर्ण। अश्व नदी में बहता हुआ वह टोकरी सारथी अधिरथ और उनकी पत्नी राधा को मिली। उन्होंने बिना किसी भेदभाव के, उसे अपने पुत्र की तरह पाला। कर्ण बड़ा होकर एक असाधारण धनुर्धर बना। पर गुरु द्रोणाचार्य ने उसे केवल इसलिए शिक्षा देने से मना कर दिया, क्योंकि वह एक सूत-पुत्र था। एक खुले प्रदर्शन में, कृपाचार्य ने सबके सामने उसके कुल पर प्रश्न उठाया — कि एक सारथी-पुत्र राजकुमारों को चुनौती कैसे दे सकता है। उसी क्षण दुर्योधन आगे आया, और कर्ण को तुरंत अंग देश का राजा घोषित कर दिया — एक मित्रता की शुरुआत, जो कर्ण के जीवन भर निभाई गई। युद्ध से पहले, कृष्ण और स्वयं कुंती ने कर्ण को उसका सच्चा जन्म बताया, और पांडवों की ओर से राज्य का प्रस्ताव दिया। पर कर्ण ने अपना जन्मसिद्ध अधिकार नहीं, बल्कि दुर्योधन के प्रति अपनी वफ़ादारी चुनी — क्योंकि धर्म उसके लिए सिर्फ खून का रिश्ता नहीं था। कुरुक्षेत्र युद्ध निकट था, जब एक ब्राह्मण के वेश में एक याचक कर्ण के द्वार पर आया — वह वास्तव में इंद्र थे, अर्जुन के पिता। कर्ण, जो प्रतिदिन सूर्य की पूजा करते हुए किसी भी याचक को खाली हाथ नहीं भेजता था, तुरंत पहचान गया कि यह याचक कौन था। बिना एक पल गंवाए, कर्ण ने अपना जन्मजात कवच और कुंडल स्वयं उतारा — अपनी सबसे बड़ी सुरक्षा को अपने ही हाथों से त्याग दिया। उसने वह दिव्य कवच याचक को सौंप दिया, यह जानते हुए भी कि अब वह युद्ध में पहले जैसा अजेय नहीं रहेगा। प्रभावित होकर इंद्र ने बदले में कर्ण को एक बार प्रयोग होने वाला शक्ति अस्त्र दिया — एक निश्चित विजय का हथियार। पर कर्ण जानता था, उसने अपनी सबसे बड़ी सुरक्षा दान में दे दी थी — केवल इसलिए, क्योंकि दान माँगने वाले को कभी मना नहीं करना उसका धर्म था। यही थी कर्ण की सच्ची पहचान — एक ऐसा दानवीर, जिसने अपने वचन और अपने धर्म को, अपने ही जीवन से भी ऊपर रखा।",
    "target_wpm": 155,
    "beats": [
      {
        "id": "H1",
        "narration": "यह कहानी एक ऐसे योद्धा की है, जो जन्म से राजकुमार था, पर जाना गया एक सारथी के पुत्र के नाम से।",
        "emotion": "curious",
        "pace": "measured",
        "duration_seconds": 10
      },
      {
        "id": "H2",
        "narration": "और जिस दिन उसकी असली पहचान सामने आई, वह पहले ही अपनी सबसे बड़ी सुरक्षा किसी और को दे चुका था।",
        "emotion": "foreboding",
        "pace": "slow",
        "duration_seconds": 10
      },
      {
        "id": "S1",
        "narration": "यह कथा शुरू होती है राजकुमारी कुंती से, जिन्हें एक दिव्य मंत्र का वरदान मिला था — जिससे वे किसी भी देवता का आवाहन कर सकती थीं।",
        "emotion": "reverent",
        "pace": "measured",
        "duration_seconds": 14
      },
      {
        "id": "S2",
        "narration": "बाल्यावस्था की जिज्ञासा में, कुंती ने सूर्यदेव का आवाहन किया। उसी क्षण, सूर्यदेव के आशीर्वाद से एक पुत्र का जन्म हुआ — कवच और कुंडल सहित, उसके शरीर से जुड़े हुए।",
        "emotion": "awed",
        "pace": "measured",
        "duration_seconds": 14
      },
      {
        "id": "S3",
        "narration": "समाज के भय से, अविवाहित कुंती को अपने नवजात पुत्र को एक टोकरी में नदी में बहा देना पड़ा। वह पुत्र था — कर्ण।",
        "emotion": "sorrowful",
        "pace": "slow",
        "duration_seconds": 14
      },
      {
        "id": "E1",
        "narration": "अश्व नदी में बहता हुआ वह टोकरी सारथी अधिरथ और उनकी पत्नी राधा को मिली। उन्होंने बिना किसी भेदभाव के, उसे अपने पुत्र की तरह पाला।",
        "emotion": "warm",
        "pace": "measured",
        "duration_seconds": 11
      },
      {
        "id": "E2",
        "narration": "कर्ण बड़ा होकर एक असाधारण धनुर्धर बना। पर गुरु द्रोणाचार्य ने उसे केवल इसलिए शिक्षा देने से मना कर दिया, क्योंकि वह एक सूत-पुत्र था।",
        "emotion": "tense",
        "pace": "measured",
        "duration_seconds": 11
      },
      {
        "id": "E3",
        "narration": "एक खुले प्रदर्शन में, कृपाचार्य ने सबके सामने उसके कुल पर प्रश्न उठाया — कि एक सारथी-पुत्र राजकुमारों को चुनौती कैसे दे सकता है।",
        "emotion": "humiliated",
        "pace": "quick",
        "duration_seconds": 11
      },
      {
        "id": "E4",
        "narration": "उसी क्षण दुर्योधन आगे आया, और कर्ण को तुरंत अंग देश का राजा घोषित कर दिया — एक मित्रता की शुरुआत, जो कर्ण के जीवन भर निभाई गई।",
        "emotion": "triumphant",
        "pace": "measured",
        "duration_seconds": 11
      },
      {
        "id": "T1",
        "narration": "युद्ध से पहले, कृष्ण और स्वयं कुंती ने कर्ण को उसका सच्चा जन्म बताया, और पांडवों की ओर से राज्य का प्रस्ताव दिया।",
        "emotion": "solemn",
        "pace": "measured",
        "duration_seconds": 13
      },
      {
        "id": "T2",
        "narration": "पर कर्ण ने अपना जन्मसिद्ध अधिकार नहीं, बल्कि दुर्योधन के प्रति अपनी वफ़ादारी चुनी — क्योंकि धर्म उसके लिए सिर्फ खून का रिश्ता नहीं था।",
        "emotion": "resolute",
        "pace": "slow",
        "duration_seconds": 13
      },
      {
        "id": "R1",
        "narration": "कुरुक्षेत्र युद्ध निकट था, जब एक ब्राह्मण के वेश में एक याचक कर्ण के द्वार पर आया — वह वास्तव में इंद्र थे, अर्जुन के पिता।",
        "emotion": "mysterious",
        "pace": "measured",
        "duration_seconds": 11
      },
      {
        "id": "R2",
        "narration": "कर्ण, जो प्रतिदिन सूर्य की पूजा करते हुए किसी भी याचक को खाली हाथ नहीं भेजता था, तुरंत पहचान गया कि यह याचक कौन था।",
        "emotion": "contemplative",
        "pace": "slow",
        "duration_seconds": 11
      },
      {
        "id": "C1",
        "narration": "बिना एक पल गंवाए, कर्ण ने अपना जन्मजात कवच और कुंडल स्वयं उतारा — अपनी सबसे बड़ी सुरक्षा को अपने ही हाथों से त्याग दिया।",
        "emotion": "sacrificial",
        "pace": "slow",
        "duration_seconds": 10
      },
      {
        "id": "C2",
        "narration": "उसने वह दिव्य कवच याचक को सौंप दिया, यह जानते हुए भी कि अब वह युद्ध में पहले जैसा अजेय नहीं रहेगा।",
        "emotion": "resolute",
        "pace": "slow",
        "duration_seconds": 10
      },
      {
        "id": "P1",
        "narration": "प्रभावित होकर इंद्र ने बदले में कर्ण को एक बार प्रयोग होने वाला शक्ति अस्त्र दिया — एक निश्चित विजय का हथियार।",
        "emotion": "reverent",
        "pace": "measured",
        "duration_seconds": 12
      },
      {
        "id": "P2",
        "narration": "पर कर्ण जानता था, उसने अपनी सबसे बड़ी सुरक्षा दान में दे दी थी — केवल इसलिए, क्योंकि दान माँगने वाले को कभी मना नहीं करना उसका धर्म था।",
        "emotion": "peaceful",
        "pace": "measured",
        "duration_seconds": 12
      },
      {
        "id": "P3",
        "narration": "यही थी कर्ण की सच्ची पहचान — एक ऐसा दानवीर, जिसने अपने वचन और अपने धर्म को, अपने ही जीवन से भी ऊपर रखा।",
        "emotion": "triumphant",
        "pace": "slow",
        "duration_seconds": 12
      }
    ]
  },
  "characters": [
    {
      "id": "karna",
      "name": "कर्ण",
      "role": "protagonist",